{
  "type": "object",
  "$schema": "http://json-schema.org/draft-03/schema",
  "required": true,
  "properties": {
    "ruleOfApplication": {
      "type": "object",
      "required": true,
      "properties": {
        "organizationId": {
          "type": "string",
          "required": false,
          "pattern": "^[a-fA-F0-9]{8}-[a-fA-F0-9]{4}-[a-fA-F0-9]{4}-[a-fA-F0-9]{4}-[a-fA-F0-9]{12}$",
          "examples": [
            "ba3dd49c-9bd3-43a3-bb54-226715e9c57a"
          ]
        },
        "environmentId": {
          "type": "string",
          "required": false,
          "minLength": 1,
          "examples": [
            "5d15a77c-0d35-400e-9a90-61d0beb09409"
          ]
        },
        "range": {
          "type": "object",
          "required": false,
          "properties": {
            "from": {
              "type": "string",
              "required": true,
              "examples": [
                "4.1.1"
              ]
            },
            "to": {
              "type": "string",
              "examples": [
                "4.1.1"
              ]
            }
          }
        }
      }
    },
    "groupId": {
      "type": "string",
      "maxLength": 256,
      "minLength": 1,
      "required": true
    },
    "assetId": {
      "type": "string",
      "maxLength": 256,
      "minLength": 1,
      "required": true
    },
    "assetVersion":{
      "type": "string",
      "maxLength": 256,
      "minLength": 1,
      "required": true
    },
    "configurationData": {
      "type": ["object", "array"],
      "required": true
    },
    "order": {
      "type": "integer",
      "minimum": 1
    },
    "disabled": {
      "type": "boolean"
    }
  }
}
